{
  "$schema": "http://json-schema.org/draft-07/schema#",
  "title": "Sprint Plan Schema",
  "type": "object",
  "required": [
    "id",
    "version",
    "stories",
    "capacity",
    "risks"
  ],
  "properties": {
    "id": {
      "type": "string"
    },
    "version": {
      "type": "string",
      "pattern": "^\\d+\\.\\d+\\.\\d+$"
    },
    "stories": {
      "type": "array",
      "items": {
        "type": "object",
        "required": [
          "id",
          "title",
          "points",
          "assignee"
        ],
        "properties": {
          "id": {
            "type": "string"
          },
          "title": {
            "type": "string"
          },
          "points": {
            "type": "number"
          },
          "assignee": {
            "type": "string"
          }
        }
      }
    },
    "capacity": {
      "type": "object",
      "required": [
        "total",
        "allocated"
      ],
      "properties": {
        "total": {
          "type": "number"
        },
        "allocated": {
          "type": "number"
        }
      }
    },
    "risks": {
      "type": "array",
      "items": {
        "type": "object",
        "required": [
          "description",
          "probability",
          "impact",
          "mitigation"
        ],
        "properties": {
          "description": {
            "type": "string"
          },
          "probability": {
            "enum": [
              "low",
              "medium",
              "high"
            ]
          },
          "impact": {
            "enum": [
              "low",
              "medium",
              "high"
            ]
          },
          "mitigation": {
            "type": "string"
          }
        }
      }
    }
  }
}